{
    "componentChunkName": "component---src-templates-article-js",
    "path": "/articles/affective-needs-in-context-longdistance-relationships-between-international-students-and-their-family",
    "result": {"data":{"mdx":{"frontmatter":{"title":"Affective Needs in Context: Long-distance Relationships Between International Students and Their Family","label":"Case study","date":"April 2018","links":["https://drive.google.com/file/d/1MXoBy7px8HhFSxGwNsISQXVBCUzX09Lg/view?usp=sharing"],"context":["MSc Human-Computer Interaction, UCL, London, UK"],"keywords":["application of theoretical frameworks","auto-ethnography","contextual inquiry","semi-structured interviews","surveys","thematic analysis","think-aloud"]},"body":"var _excluded = [\"components\"];\n\nfunction _extends() { _extends = Object.assign || function (target) { for (var i = 1; i < arguments.length; i++) { var source = arguments[i]; for (var key in source) { if (Object.prototype.hasOwnProperty.call(source, key)) { target[key] = source[key]; } } } return target; }; return _extends.apply(this, arguments); }\n\nfunction _objectWithoutProperties(source, excluded) { if (source == null) return {}; var target = _objectWithoutPropertiesLoose(source, excluded); var key, i; if (Object.getOwnPropertySymbols) { var sourceSymbolKeys = Object.getOwnPropertySymbols(source); for (i = 0; i < sourceSymbolKeys.length; i++) { key = sourceSymbolKeys[i]; if (excluded.indexOf(key) >= 0) continue; if (!Object.prototype.propertyIsEnumerable.call(source, key)) continue; target[key] = source[key]; } } return target; }\n\nfunction _objectWithoutPropertiesLoose(source, excluded) { if (source == null) return {}; var target = {}; var sourceKeys = Object.keys(source); var key, i; for (i = 0; i < sourceKeys.length; i++) { key = sourceKeys[i]; if (excluded.indexOf(key) >= 0) continue; target[key] = source[key]; } return target; }\n\n/* @jsxRuntime classic */\n\n/* @jsx mdx */\nvar _frontmatter = {\n  \"title\": \"Affective Needs in Context: Long-distance Relationships Between International Students and Their Family\",\n  \"slug\": \"affective-needs-in-context-longdistance-relationships-between-international-students-and-their-family\",\n  \"preview\": \"Case study about technologyâ€™s impact on affective needs\",\n  \"label\": \"Case study\",\n  \"date\": \"April 2018\",\n  \"links\": [\"https://drive.google.com/file/d/1MXoBy7px8HhFSxGwNsISQXVBCUzX09Lg/view?usp=sharing\"],\n  \"context\": [\"MSc Human-Computer Interaction, UCL, London, UK\"],\n  \"keywords\": [\"application of theoretical frameworks\", \"auto-ethnography\", \"contextual inquiry\", \"semi-structured interviews\", \"surveys\", \"thematic analysis\", \"think-aloud\"],\n  \"order\": 5\n};\nvar layoutProps = {\n  _frontmatter: _frontmatter\n};\nvar MDXLayout = \"wrapper\";\nreturn function MDXContent(_ref) {\n  var components = _ref.components,\n      props = _objectWithoutProperties(_ref, _excluded);\n\n  return mdx(MDXLayout, _extends({}, layoutProps, props, {\n    components: components,\n    mdxType: \"MDXLayout\"\n  }), mdx(\"h1\", null, \"Affective Needs in Context: Long-distance Relationships Between International Students and Their Family\"), mdx(\"p\", null, \"Case study about technology\\u2019s impact on affective needs\"), mdx(\"p\", null, \"From January to April 2018, I worked on a case study that focused on technological impact on affective needs in the context of long-distance relationships between international students and their families. This study consists of two parts: (1) a qualitative study, conducted as part of a team of six, and (2) an individual analysis of the findings and future directions of technology. This project was part of my MSc Human-Computer Interaction, Affective Interaction module.\"), mdx(\"p\", null, \"This article summarises a University assignment paper. You can check the \", mdx(\"a\", {\n    parentName: \"p\",\n    \"href\": \"https://drive.google.com/file/d/1MXoBy7px8HhFSxGwNsISQXVBCUzX09Lg/view?usp=sharing\"\n  }, \"original paper with in depth analysis and references as PDF\"), \".\"), mdx(\"h2\", null, \"Emotion\\u2019s role in technology\"), mdx(\"p\", null, \"Affective Computing or Interaction aims to bridge the gap between human emotions and technologies. It has been demonstrated that \", mdx(\"a\", {\n    parentName: \"p\",\n    \"href\": \"https://www.sciencedirect.com/science/article/pii/S1389041708000284\"\n  }, \"emotion plays a critical role in our judgement and adaptive regulation of thought\"), \". In this article, \\u201Caffective states\\u201D, refers to moods and emotions as embodied reactions or pleasure or displeasure towards something. This is expressed over multiple systems of an organism. For example, not just having happy thoughts and feelings, but also expressing them in the face, body or actions.\"), mdx(\"h2\", null, \"Empathy as a tool for understanding experience\"), mdx(\"p\", null, \"When we use technology, we make sense of it, we have certain expectations and biases, but we also \", mdx(\"em\", {\n    parentName: \"p\"\n  }, \"feel\"), \" something towards it. And this also dictates how we use said technology. There are design or theoretical frameworks aimed to support understanding and assessment of emotions in design.\"), mdx(\"p\", null, \"This study applies \", mdx(\"a\", {\n    parentName: \"p\",\n    \"href\": \"https://mitpress.mit.edu/books/technology-experience#:~:text=In%20Technology%20as%20Experience%2C%20John,out%3B%20we%20live%20with%20it.\"\n  }, \"McCarthy and Wright\\u2019s Technology as Experience\"), \" theoretical framework to understand students\\u2019 subjective experience and their affective states when using technology to stay in touch with their families from abroad. The framework is based on the appraisal theory and proposes four threads of holistic experience:\"), mdx(\"ul\", null, mdx(\"li\", {\n    parentName: \"ul\"\n  }, \"Sensual: how do we engage with this technology?\"), mdx(\"li\", {\n    parentName: \"ul\"\n  }, \"Emotional: what are our reactions and judgements about it?\"), mdx(\"li\", {\n    parentName: \"ul\"\n  }, \"Compositional: how do these elements fit together in a coherent experience?\"), mdx(\"li\", {\n    parentName: \"ul\"\n  }, \"Spatio-temporal: what effects do time and space have on our experience?\")), mdx(\"p\", null, \"Additionally, there are six sense-making processes: anticipating, connecting, interpreting, reflecting, approaching, recounting.\"), mdx(\"p\", null, \"Furthermore, the team consisted of international students which meant we could use our own ethnographic experience to inform the study. We used \", mdx(\"a\", {\n    parentName: \"p\",\n    \"href\": \"https://www.researchgate.net/publication/326012173_Autoethnography_in_Human-Computer_Interaction_Theory_and_Practice#:~:text=Autoethnography%20is%20an%20ethnographic%20method,of%20other%20observed%20social%20actors.&text=In%20this%20chapter%2C%20I%20will,potential%20implications%20for%20HCI%20research.\"\n  }, \"auto-ethnography\"), \" to apply this theory on our experiences. As a result, we developed a semi-structured interview to understand people\\u2019s perceptions and experiences of this topic.\"), mdx(\"p\", null, \"As \", mdx(\"a\", {\n    parentName: \"p\",\n    \"href\": \"https://www.nngroup.com/articles/negativity-bias-ux/\"\n  }, \"people\\u2019s ability to self-report their emotions can be limited\"), \", we also applied a \", mdx(\"a\", {\n    parentName: \"p\",\n    \"href\": \"https://www.nngroup.com/articles/thinking-aloud-the-1-usability-tool/\"\n  }, \"think-aloud approach\"), \" where we asked participants to show us how they interact with their most used technology to contact their family. The think-aloud approach is aimed at the user's interaction behaviour as well as their rationale behind it, and it reinforces reappraisal and helps users verbalise their affective states. Additionally, to enhance reappraisal, we asked participants to focus on a specific time they tried to contact their family and to try to describe how they felt by guiding them with open-ended questions.\"), mdx(\"h2\", null, \"Making sense of the data\"), mdx(\"p\", null, \"We interviewed 10 international students from UCL, which were contacted directly and asked to take part in our study. Data analysis was conducted through \", mdx(\"a\", {\n    parentName: \"p\",\n    \"href\": \"https://www.interaction-design.org/literature/article/how-to-do-a-thematic-analysis-of-user-interviews\"\n  }, \"thematic analysis\"), \". Interviews were recorded and transcribed immediately after the session. Each of us performed thematic analysis to define codes and work towards unifying them and discussing what themes emerge from this. We went through an iterative process to refine our findings and formed an affinity diagram to help visualise the themes, concepts and relationships.\"), mdx(\"p\", null, \"Our research found that living far from family can impose some difficulties amongst international students. Homesickness is an affective need that was amongst most prevalent themes and evidence of frustration with technology was found. Additionally, we identified technological barriers such as limited network connection, limited technology experience of the participant\\u2019s family, and non-technological barriers such as unaccommodating time zones. Our participants reported they use mostly mobile apps, which means that spatio-temporal aspects are crucial to making a pleasant experience.\"), mdx(\"p\", null, mdx(\"em\", {\n    parentName: \"p\"\n  }, \"Please refer to \", mdx(\"a\", {\n    parentName: \"em\",\n    \"href\": \"https://drive.google.com/file/d/1MXoBy7px8HhFSxGwNsISQXVBCUzX09Lg/view\"\n  }, \"the paper\"), \" if you\\u2019d like to see the entire data analysis with quotes, and full interpretation of the findings.\")));\n}\n;\nMDXContent.isMDXComponent = true;"}},"pageContext":{"slug":"affective-needs-in-context-longdistance-relationships-between-international-students-and-their-family"}},
    "staticQueryHashes": ["3000541721"]}