{
    "componentChunkName": "component---src-templates-article-js",
    "path": "/articles/dementia-environmental-assessment-tool",
    "result": {"data":{"mdx":{"frontmatter":{"title":"Dementia Environmental Assessment Tool","label":"Mobile app","date":"May 2017","links":["https://github.com/alexandrastoica/ionic2-assessment-app"],"context":["Media Lab, University of Worcester, UK","Collaboration with NHS Kings Fund and Association for Dementia Studies"],"keywords":["Angular","HTML5 + Sass","Javascript/Typecript","PouchDB"]},"body":"var _excluded = [\"components\"];\n\nfunction _extends() { _extends = Object.assign || function (target) { for (var i = 1; i < arguments.length; i++) { var source = arguments[i]; for (var key in source) { if (Object.prototype.hasOwnProperty.call(source, key)) { target[key] = source[key]; } } } return target; }; return _extends.apply(this, arguments); }\n\nfunction _objectWithoutProperties(source, excluded) { if (source == null) return {}; var target = _objectWithoutPropertiesLoose(source, excluded); var key, i; if (Object.getOwnPropertySymbols) { var sourceSymbolKeys = Object.getOwnPropertySymbols(source); for (i = 0; i < sourceSymbolKeys.length; i++) { key = sourceSymbolKeys[i]; if (excluded.indexOf(key) >= 0) continue; if (!Object.prototype.propertyIsEnumerable.call(source, key)) continue; target[key] = source[key]; } } return target; }\n\nfunction _objectWithoutPropertiesLoose(source, excluded) { if (source == null) return {}; var target = {}; var sourceKeys = Object.keys(source); var key, i; for (i = 0; i < sourceKeys.length; i++) { key = sourceKeys[i]; if (excluded.indexOf(key) >= 0) continue; target[key] = source[key]; } return target; }\n\n/* @jsxRuntime classic */\n\n/* @jsx mdx */\nvar _frontmatter = {\n  \"title\": \"Dementia Environmental Assessment Tool\",\n  \"slug\": \"dementia-environmental-assessment-tool\",\n  \"preview\": \"Paper-based tool turned mobile app\",\n  \"label\": \"Mobile app\",\n  \"date\": \"May 2017\",\n  \"links\": [\"https://github.com/alexandrastoica/ionic2-assessment-app\"],\n  \"context\": [\"Media Lab, University of Worcester, UK\", \"Collaboration with NHS Kings Fund and Association for Dementia Studies\"],\n  \"keywords\": [\"Angular\", \"HTML5 + Sass\", \"Javascript/Typecript\", \"PouchDB\"],\n  \"order\": 1\n};\nvar layoutProps = {\n  _frontmatter: _frontmatter\n};\nvar MDXLayout = \"wrapper\";\nreturn function MDXContent(_ref) {\n  var components = _ref.components,\n      props = _objectWithoutProperties(_ref, _excluded);\n\n  return mdx(MDXLayout, _extends({}, layoutProps, props, {\n    components: components,\n    mdxType: \"MDXLayout\"\n  }), mdx(\"h1\", null, \"Dementia Environmental Assessment Tool\"), mdx(\"p\", null, \"Paper-based tool turned mobile app\"), mdx(\"h2\", null, \"Challenge\"), mdx(\"p\", null, \"In Year 2 and 3 of my undergraduate studies (2015 - 2017), I worked for University of Worcester's Media Lab. There, I got the opportunity to work with the Association of Dementia Studies, based on campus. They had been working on a \", mdx(\"a\", {\n    parentName: \"p\",\n    \"href\": \"https://www.kingsfund.org.uk/projects/enhancing-healing-environment/ehe-design-dementia\"\n  }, \"paper-based tool for dementia environmental assessment\"), \". The tool consisted of a series of questions based on environments which care workers had to evaluate on a 1 to 5 scale. The problem they were facing was increasing amounts of data that required tedious manual work with no easy way to analyse it. They were seeking for a better, accessible, and secured way of gathering this data.\"), mdx(\"p\", null, \"As a result, I built a mobile app for iOS and Android which enabled the centralisation of data and streamlined manual processing by implementing an exporting feature via csv format.\"), mdx(\"h2\", null, \"Initial research\"), mdx(\"p\", null, \"After familiarising myself with the context of the tool, I collated a list of considerations that would help inform the design and development process:\"), mdx(\"ul\", null, mdx(\"li\", {\n    parentName: \"ul\"\n  }, \"A mobile app is most suitable because of its ubiquitous nature\"), mdx(\"li\", {\n    parentName: \"ul\"\n  }, \"Protect privacy: secure and anonymise data\"), mdx(\"li\", {\n    parentName: \"ul\"\n  }, \"Care workers would use this app to log in data for patients\"), mdx(\"li\", {\n    parentName: \"ul\"\n  }, \"The app had to be usable offline because many care homes did not have Wi-Fi and couldn\\u2019t rely on constant Internet connection\"), mdx(\"li\", {\n    parentName: \"ul\"\n  }, \"Design a user experience that addresses constraints in mobile apps, and the user-group specific needs\"), mdx(\"li\", {\n    parentName: \"ul\"\n  }, \"Ensure W3C accessibility compliance\"), mdx(\"li\", {\n    parentName: \"ul\"\n  }, \"Collaboration with the client in order to set the requirements - we could not undertake user testing ourselves\")), mdx(\"h2\", null, \"Initial design\"), mdx(\"p\", null, \"I designed a simple interface which consisted of three main views:\"), mdx(\"ul\", null, mdx(\"li\", {\n    parentName: \"ul\"\n  }, mdx(\"strong\", {\n    parentName: \"li\"\n  }, \"Login view\"), \": to ensure we protect the data, a user had to create a password protected account to be able to use it\"), mdx(\"li\", {\n    parentName: \"ul\"\n  }, mdx(\"strong\", {\n    parentName: \"li\"\n  }, \"Profile view\"), \": here you could see your name and email address\"), mdx(\"li\", {\n    parentName: \"ul\"\n  }, mdx(\"strong\", {\n    parentName: \"li\"\n  }, \"Assessments view\"), \": this is where all assessments could be managed - add, edit, continue, export, delete an assessment\"), mdx(\"li\", {\n    parentName: \"ul\"\n  }, mdx(\"strong\", {\n    parentName: \"li\"\n  }, \"Tutorial view\"), \": this would provide the user with instructions on how to create, complete, export and delete an assessment\")), mdx(\"p\", null, \"The assessment, once opened, displayed a list of categories of the tool and a progress indicator. Each category went through a series of questions, navigable by next and previous buttons.\"), mdx(\"h3\", null, \"Data protection\"), mdx(\"p\", null, \"Because the app was collecting personal information, it didn\\u2019t ask for identifiable data, to ensure it was anonymised. The user was also encouraged to export the data as soon as possible and delete the assessment from the app.\"), mdx(\"h2\", null, \"Technologies\"), mdx(\"p\", null, \"After a few rapid prototypes using just HTML/CSS and \", mdx(\"a\", {\n    parentName: \"p\",\n    \"href\": \"https://cordova.apache.org/\"\n  }, \"Cordova\"), \", we decided on a final design and user flow. This was the time to think about what technologies will enable the implementation.\"), mdx(\"p\", null, mdx(\"a\", {\n    parentName: \"p\",\n    \"href\": \"https://ionicframework.com/\"\n  }, \"Ionic framework\"), \" was a good candidate for hybrid mobile development because it came with a library of iOS and Android UI native components which made it easy to rapidly build the interfaces. It was also an efficient way to develop for both mobile platforms.\"), mdx(\"p\", null, \"At the time of the start of the development process (approx. Summer 2016), Ionic was based on Angularjs. Angular 2 (Typescript) was still in beta, but it was possible to build apps with it by using Ionic 2. I took this as a good opportunity to learn Typescript and the new Angular. The app was scheduled to be used internally in 2017 and possibly released later than that.\"), mdx(\"p\", null, \"When choosing a database, offline capabilities were crucial. I had recently learnt about \", mdx(\"a\", {\n    parentName: \"p\",\n    \"href\": \"https://pouchdb.com/\"\n  }, \"PouchDB\"), \". It enabled offline syncs, which meant the user could use the app seamlessly and the data would be uploaded in the cloud when the app re-connected to the Internet.\"), mdx(\"p\", null, \"Finally, it was important to find a way to export the assessment in an appropriate format. Previously, the data was manually entered in Microsoft Excel from the paper-based tool. This required a serious amount of time and was prone to human error. To alleviate this, the app offered a csv export feature. From client feedback, email attachment was the most accessible to them. As such, the export feature would open the email app on the phone and add it as attachment to a new email which could be sent. Luckily, Ionic came with a plugins API which enabled native behaviour: the \", mdx(\"a\", {\n    parentName: \"p\",\n    \"href\": \"https://ionicframework.com/docs/native/social-sharing\"\n  }, \"social sharing plugin\"), \" for opening the email app and the \", mdx(\"a\", {\n    parentName: \"p\",\n    \"href\": \"https://ionicframework.com/docs/native/file\"\n  }, \"file plugin\"), \" for creating a csv file and adding an attachment. The app was implemented over the next year, until I graduated in 2017.\"), mdx(\"h2\", null, \"Publication\"), mdx(\"p\", null, \"The app was published on Google Play Store.\"));\n}\n;\nMDXContent.isMDXComponent = true;"}},"pageContext":{"slug":"dementia-environmental-assessment-tool"}},
    "staticQueryHashes": ["3000541721"]}