{
    "componentChunkName": "component---src-templates-article-js",
    "path": "/articles/e-learning-beyond-the-graphical-user-interface",
    "result": {"data":{"mdx":{"frontmatter":{"title":"E-learning: Beyond the Graphical User Interface","label":"Reasearch proposal","date":"April 2018","links":["https://drive.google.com/file/d/18lIyR1D1ArGXWBCeqLhxTVyhtf3uVSdH/view?usp=sharing"],"context":["MSc Human-Computer Interaction, UCL, London, UK"],"keywords":["experiment","qualitative research","quantitative research","semi-structured interviews"]},"body":"var _excluded = [\"components\"];\n\nfunction _extends() { _extends = Object.assign || function (target) { for (var i = 1; i < arguments.length; i++) { var source = arguments[i]; for (var key in source) { if (Object.prototype.hasOwnProperty.call(source, key)) { target[key] = source[key]; } } } return target; }; return _extends.apply(this, arguments); }\n\nfunction _objectWithoutProperties(source, excluded) { if (source == null) return {}; var target = _objectWithoutPropertiesLoose(source, excluded); var key, i; if (Object.getOwnPropertySymbols) { var sourceSymbolKeys = Object.getOwnPropertySymbols(source); for (i = 0; i < sourceSymbolKeys.length; i++) { key = sourceSymbolKeys[i]; if (excluded.indexOf(key) >= 0) continue; if (!Object.prototype.propertyIsEnumerable.call(source, key)) continue; target[key] = source[key]; } } return target; }\n\nfunction _objectWithoutPropertiesLoose(source, excluded) { if (source == null) return {}; var target = {}; var sourceKeys = Object.keys(source); var key, i; for (i = 0; i < sourceKeys.length; i++) { key = sourceKeys[i]; if (excluded.indexOf(key) >= 0) continue; target[key] = source[key]; } return target; }\n\n/* @jsxRuntime classic */\n\n/* @jsx mdx */\nvar _frontmatter = {\n  \"title\": \"E-learning: Beyond the Graphical User Interface\",\n  \"slug\": \"e-learning-beyond-the-graphical-user-interface\",\n  \"preview\": \"Research proposal for a mixed reality approach to E-learning\",\n  \"label\": \"Reasearch proposal\",\n  \"date\": \"April 2018\",\n  \"links\": [\"https://drive.google.com/file/d/18lIyR1D1ArGXWBCeqLhxTVyhtf3uVSdH/view?usp=sharing\"],\n  \"context\": [\"MSc Human-Computer Interaction, UCL, London, UK\"],\n  \"keywords\": [\"experiment\", \"qualitative research\", \"quantitative research\", \"semi-structured interviews\"],\n  \"order\": 3\n};\nvar layoutProps = {\n  _frontmatter: _frontmatter\n};\nvar MDXLayout = \"wrapper\";\nreturn function MDXContent(_ref) {\n  var components = _ref.components,\n      props = _objectWithoutProperties(_ref, _excluded);\n\n  return mdx(MDXLayout, _extends({}, layoutProps, props, {\n    components: components,\n    mdxType: \"MDXLayout\"\n  }), mdx(\"h1\", null, \"E-learning Beyond the Graphical User Interface\"), mdx(\"p\", null, \"Research proposal for a mixed reality approach to E-learning\"), mdx(\"p\", null, \"From January to April 2018, I worked on a research proposal that aims to cover a future interface topic or concept. My choice of focus was on how mixed reality might come into play to support the learning experience by exploring learning theories (i.e., social cognitive theory) and application of the mixed reality continuum. The proposal combines both qualitative and quantitative approaches. This project was part of my MSc Human-Computer Interaction, Future Interfaces module.\"), mdx(\"p\", null, \"This article summarises a University assignment paper. You can check the \", mdx(\"a\", {\n    parentName: \"p\",\n    \"href\": \"https://drive.google.com/file/d/18lIyR1D1ArGXWBCeqLhxTVyhtf3uVSdH/view\"\n  }, \"original paper with in depth analysis and references as PDF\"), \".\"), mdx(\"h2\", null, \"Abstract\"), mdx(\"p\", null, \"Ubiquitous technology delivers education new possibilities, shifting from the two-dimensional environment to technology-enhanced simulations which permits students and teachers to go beyond the traditional didactic methods. In this paper we present an e-learning concept that leverages the power of mixed reality. By taking advantage of learning theories and mixed reality, we propose a system that aims to achieve seamless interaction in order to facilitate the learning outcomes, allowing the user to adapt the level of immersion to their needs. We further propose an evaluation plan which aims to assert whether enhancing e-learning with mixed reality is effective and achieves seamlessness.\"), mdx(\"h2\", null, \"Why is e-learning important?\"), mdx(\"p\", null, \"As technology becomes ubiquitous, there has been a shift in higher education and pedagogy from traditional education practices towards more self-driven online education. E-learning is the concept and implementation of an online education approach, becoming well established and adapted by multiple educational systems, as modern technologies emerge.\"), mdx(\"p\", null, \"As an integral part of the educational system, e-learning is an effective tool as it offers flexibility through a wide range of opportunities within academic institutions and not only, for learners or academic qualification seekers to fulfil their educational objectives. On the opposite side, \", mdx(\"a\", {\n    parentName: \"p\",\n    \"href\": \"https://cshe.berkeley.edu/publications/strategies-e-learning-universities\"\n  }, \"it provides teachers, instructors or professors with novel and flexible ways to teach their students\"), \".\"), mdx(\"h2\", null, \"Graphical vs Tangible user interfaces\"), mdx(\"p\", null, \"In contrast to \", mdx(\"a\", {\n    parentName: \"p\",\n    \"href\": \"https://dl.acm.org/doi/10.5555/98326.98408\"\n  }, \"graphical user interfaces (GUIs) established by Xerox\"), \", which represented a \\\"desktop metaphor\\\" that simulates the physical desktop onto the screen, \", mdx(\"a\", {\n    parentName: \"p\",\n    \"href\": \"https://dl.acm.org/doi/10.1145/258549.258715\"\n  }, \"tangible user interfaces\"), \" (TUIs) augment the physical world by associating digital information to physical objects from the real world, used in the everyday life. Their basis is on the notion of \", mdx(\"a\", {\n    parentName: \"p\",\n    \"href\": \"https://dl.acm.org/doi/10.1145/329124.329126\"\n  }, \"\\\"ubiquitous computing\\\", first coined by Mark Weiser in 1991\"), \" - a computing and human-computer interaction (HCI) paradigm which attempts to make computers invisible.\"), mdx(\"p\", null, mdx(\"a\", {\n    parentName: \"p\",\n    \"href\": \"https://dl.acm.org/doi/10.1145/192426.192428\"\n  }, \"Weiser\\u2019s vision of ubiquitous (or pervasive) computing was \\\"invisibility\\\"\"), \". They described the concept of seamless technology as a tool that does not intrude the user's consciousness, allowing them to focus solely on the task they perform, rather than on the technology they interact with. Technology such as AR, MR and VR sustain seamlessness, bridging the gap between the virtual and physical world. Their focus is to \", mdx(\"a\", {\n    parentName: \"p\",\n    \"href\": \"https://www.mitpressjournals.org/doi/10.1162/pres.1997.6.4.386\"\n  }, \"extend the human-computer interface into the physical space\"), \" through computer-generated 3D objects.\"), mdx(\"h2\", null, \"Taking e-learning beyond the GUI\"), mdx(\"p\", null, \"Beyond the graphical user interface (GUI), there has been work around the impact of virtual reality environments (VREs) on learning. There is compelling evidence which shows that \", mdx(\"a\", {\n    parentName: \"p\",\n    \"href\": \"https://www.tandfonline.com/doi/full/10.3109/0142159X.2012.714886\"\n  }, \"simulation can improve learner competence and skills compared to traditional approaches\"), \". Immersion can vary from low (i.e., illustrated textbooks to low immersion, such\"), mdx(\"p\", null, \"as educational games on a computer screen) to high immersion (i.e., educational games presented using a head-mounted display). A study comparing low to high immersion environments in the context of learning suggests that \", mdx(\"a\", {\n    parentName: \"p\",\n    \"href\": \"https://www.tandfonline.com/doi/abs/10.1207/S1532690XCI1902_02\"\n  }, \"higher immersion imposes deeper understanding of concepts\"), \" and thus more efficient learning.\"), mdx(\"p\", null, \"According to \", mdx(\"a\", {\n    parentName: \"p\",\n    \"href\": \"https://books.google.co.uk/books?id=I3AWAAAAIAAJ\"\n  }, \"learning theories\"), \", immersive environments enhance presence, thus causing the learner to process information more deeply. Through immersion, \", mdx(\"a\", {\n    parentName: \"p\",\n    \"href\": \"https://dl.acm.org/doi/10.1162/pres.1997.6.6.603\"\n  }, \"the virtual environment excludes real world stimuli from the user\"), \" providing panoramic surroundings that completely put the user in a different place, not just visually. \", mdx(\"a\", {\n    parentName: \"p\",\n    \"href\": \"https://www.mitpressjournals.org/doi/10.1162/105474699566107\"\n  }, \"Higher immersion promotes higher presence\"), \", which represents the degree to which users feel that they are in an environment that is different from where they actually are.\"), mdx(\"p\", null, \"Additionally, seamless interaction promotes a stronger sense of presence due to the more natural interaction which might result in cognitive load reduction. Hence, it was found that \", mdx(\"a\", {\n    parentName: \"p\",\n    \"href\": \"https://www.tandfonline.com/doi/abs/10.1207/S1532690XCI1902_02\"\n  }, \"students learnt more deeply when the immersion was high\"), \", as it promotes engagement and presence.\"), mdx(\"h2\", null, \"Finding the place on the Reality-Virtuality Spectrum\"), mdx(\"p\", null, \"Mixed reality (MR) in the e-learning context can provide students a learning environment that clearly shows the disparity between theory and practice as simulation can also represent a prerequisite for \", mdx(\"a\", {\n    parentName: \"p\",\n    \"href\": \"https://www.researchgate.net/publication/26488981_Mixed_reality_learning_spaces_for_collaborative_experimentation_A_challenge_for_engineering_education_and_training\"\n  }, \"learning psychomotor skills whilst providing an in-depth understanding of the theory\"), \". By emerging virtual and real worlds, MR can add to e-learning haptic feedback, 3D modelling, simulations, just to name a few, creating a seamless interaction. Furthermore, \", mdx(\"a\", {\n    parentName: \"p\",\n    \"href\": \"https://www.tandfonline.com/doi/abs/10.1207/S1532690XCI1902_02\"\n  }, \"narration was found more effective than displayed text\"), \" in terms of learning outcomes, and \", mdx(\"a\", {\n    parentName: \"p\",\n    \"href\": \"https://dl.acm.org/doi/10.1145/292834.292836\"\n  }, \"MR can improve collaborative work substantially\"), \".\"), mdx(\"h2\", null, \"The proposed system\"), mdx(\"p\", null, \"In the paper, I describe a system that leverages the mixed reality concept in order to enhance the potential of e-learning.\"), mdx(\"p\", null, \"The system is composed of physical objects: a book and a head-mounted display (HMD) with headphones and microphone. The physical book serves as the main user interface. Users can use the book without technology, still being able to read text and view images. Through the HMD, users can see 3D computer-generated objects on top of the pages in AR.\"), mdx(\"p\", null, \"The role of these animated objects is to enable further exploration of the concept presented on the physical book as text or image. The virtual objects come with audio sounds that provide a deeper explanation for the content, in the form of a narration. The user can interact with the system through voice and gestures.\"), mdx(\"p\", null, \"Users are free to explore the book by turning the pages and from multiple perspectives by moving themselves, the book or manipulating the objects through gestures and/or voice - this does not constrain users to remain still or in the same place. In addition to this, VR view enables them to fully immerse into the scene and interact with the objects. By offering the full Reality-Virtuality spectrum, users can adjust the level of immersion and exploration to their needs.\"), mdx(\"p\", null, mdx(\"em\", {\n    parentName: \"p\"\n  }, \"Please refer to \", mdx(\"a\", {\n    parentName: \"em\",\n    \"href\": \"https://drive.google.com/file/d/18lIyR1D1ArGXWBCeqLhxTVyhtf3uVSdH/view?usp=sharing\"\n  }, \"the paper\"), \" if you\\u2019d like to see more details and how I propose this system is evaluated.\")));\n}\n;\nMDXContent.isMDXComponent = true;"}},"pageContext":{"slug":"e-learning-beyond-the-graphical-user-interface"}},
    "staticQueryHashes": ["3000541721"]}